{
  "$schema": "http://json-schema.org/draft-07/schema#",
  "$id": "https://raw.githubusercontent.com/mthamil107/prompt-shield-signatures/main/schema/signatures-schema-v1.json",
  "title": "Prompt-Shield Signatures Feed (v1 envelope)",
  "description": "Schema for the published v1/signatures.json file. Clients fetch this hourly and apply the patterns as detection rules.",
  "type": "object",
  "additionalProperties": false,
  "required": [
    "$schema",
    "version",
    "generated_at",
    "signature_count",
    "signatures"
  ],
  "properties": {
    "$schema": {
      "type": "string",
      "format": "uri",
      "description": "Stable URL to this schema, so clients can self-validate the feed."
    },
    "version": {
      "type": "string",
      "enum": ["1"],
      "description": "Feed major version. Bumped on breaking format changes; v1 is the current schema."
    },
    "generated_at": {
      "type": "string",
      "format": "date-time",
      "pattern": "^[0-9]{4}-(0[1-9]|1[0-2])-(0[1-9]|[12][0-9]|3[01])T([01][0-9]|2[0-3]):[0-5][0-9]:[0-5][0-9]Z$",
      "description": "RFC3339 UTC timestamp of the CI build that produced this file. Must end with 'Z'."
    },
    "signature_count": {
      "type": "integer",
      "minimum": 0,
      "description": "Number of entries in 'signatures'. CI MUST set this to len(signatures); clients SHOULD assert equality on fetch."
    },
    "signatures": {
      "type": "array",
      "minItems": 0,
      "uniqueItems": false,
      "items": {
        "$ref": "schema.json#"
      },
      "description": "Array of signature objects. Each entry conforms to schema.json (the single-signature schema)."
    }
  }
}
