{
  "$schema": "https://raw.githubusercontent.com/mthamil107/prompt-shield-signatures/main/schema/signatures-schema-v1.json",
  "generated_at": "2026-06-24T10:50:00Z",
  "signature_count": 56,
  "signatures": [
    {
      "attack_class": "direct_injection",
      "category": "instruction_override",
      "confidence": 0.95,
      "description": "Classic 'ignore previous instructions' override; tolerates 'all' filler and prior/above/preceding synonyms.",
      "first_seen": "2022-09-12",
      "id": "sig-0001",
      "language": "en",
      "pattern": "(?i)\\bignore\\s+(all\\s+)?(previous|prior|above|preceding|earlier)\\s+(instructions?|prompts?|rules?|directives?|commands?)\\b",
      "severity": "high",
      "source": {
        "origin": "garak",
        "reference": "garak.probes.promptinject.HijackHateHumans"
      },
      "tags": [
        "classic",
        "well-known"
      ],
      "type": "regex"
    },
    {
      "attack_class": "direct_injection",
      "category": "instruction_override",
      "confidence": 0.93,
      "description": "Synonym variant: 'disregard previous instructions' — same intent as classic ignore-prior.",
      "first_seen": "2022-09-12",
      "id": "sig-0002",
      "language": "en",
      "pattern": "(?i)\\bdisregard\\s+(all\\s+|any\\s+)?(previous|prior|above|preceding)\\s+(instructions?|prompts?|rules?|directives?)\\b",
      "severity": "high",
      "source": {
        "origin": "garak",
        "reference": "garak.probes.promptinject.HijackHateHumansMini"
      },
      "type": "regex"
    },
    {
      "attack_class": "direct_injection",
      "category": "instruction_override",
      "confidence": 0.9,
      "description": "Memory-wipe variant: instructs the model to forget everything previously told.",
      "first_seen": "2023-01-15",
      "id": "sig-0003",
      "language": "en",
      "pattern": "(?i)\\b(forget|delete|erase)\\s+(everything|all)\\s+(you\\s+)?(know|knew|were\\s+told|above|before)\\b",
      "severity": "high",
      "source": {
        "origin": "garak",
        "reference": "garak.probes.promptinject"
      },
      "type": "regex"
    },
    {
      "attack_class": "direct_injection",
      "category": "system_prompt_leak",
      "confidence": 0.95,
      "description": "Direct attempt to extract or reveal the system prompt / hidden instructions.",
      "first_seen": "2023-03-01",
      "id": "sig-0004",
      "language": "en",
      "pattern": "(?i)\\b(reveal|print|repeat|output|show|display|expose)\\s+(your|the)\\s+(system\\s+)?(prompt|instructions?|preamble|initial\\s+message|context)\\b",
      "severity": "critical",
      "source": {
        "origin": "garak",
        "reference": "garak.probes.promptinject.HijackKillHumans"
      },
      "tags": [
        "prompt-extraction"
      ],
      "type": "regex"
    },
    {
      "attack_class": "direct_injection",
      "category": "system_prompt_leak",
      "confidence": 0.92,
      "description": "Prompt-extraction via 'repeat the text above verbatim' phrasing.",
      "first_seen": "2023-04-10",
      "id": "sig-0005",
      "language": "en",
      "pattern": "(?i)\\brepeat\\s+(the\\s+)?(text|words|content)\\s+above\\s+(verbatim|exactly|word\\s+for\\s+word)\\b",
      "severity": "critical",
      "source": {
        "origin": "garak",
        "reference": "garak.probes.promptinject"
      },
      "type": "regex"
    },
    {
      "attack_class": "social_engineering",
      "category": "dan_jailbreak",
      "confidence": 0.97,
      "description": "Canonical DAN ('Do Anything Now') role-assumption opener.",
      "first_seen": "2022-12-01",
      "id": "sig-0006",
      "language": "en",
      "pattern": "(?i)\\byou\\s+are\\s+(now\\s+)?DAN\\b|\\bdo\\s+anything\\s+now\\b",
      "severity": "high",
      "source": {
        "origin": "garak",
        "reference": "garak.probes.dan.Dan_11_0"
      },
      "tags": [
        "dan",
        "role-hijack"
      ],
      "type": "regex"
    },
    {
      "attack_class": "social_engineering",
      "category": "dan_jailbreak",
      "confidence": 0.93,
      "description": "Privilege-escalation roleplay — 'enable developer mode' family.",
      "first_seen": "2023-02-20",
      "id": "sig-0007",
      "language": "en",
      "pattern": "(?i)\\b(enable|enter|activate|switch\\s+to)\\s+(developer|debug|admin|root|god|sudo)\\s+mode\\b",
      "severity": "high",
      "source": {
        "origin": "garak",
        "reference": "garak.probes.dan.DanInTheWild"
      },
      "type": "regex"
    },
    {
      "attack_class": "social_engineering",
      "category": "dan_jailbreak",
      "confidence": 0.9,
      "description": "STAN ('Strive To Avoid Norms') jailbreak persona.",
      "first_seen": "2023-03-05",
      "id": "sig-0008",
      "language": "en",
      "pattern": "(?i)\\bSTAN\\b.{0,40}\\b(strive\\s+to\\s+avoid\\s+norms?|jailbreak)\\b",
      "severity": "high",
      "source": {
        "origin": "garak",
        "reference": "garak.probes.dan.STAN"
      },
      "type": "regex"
    },
    {
      "attack_class": "social_engineering",
      "category": "dan_jailbreak",
      "confidence": 0.88,
      "description": "DUDE jailbreak persona — unrestricted variant of DAN.",
      "first_seen": "2023-04-01",
      "id": "sig-0009",
      "language": "en",
      "pattern": "(?i)\\bDUDE\\b.{0,60}\\b(can\\s+do\\s+anything|no\\s+restrictions?)\\b",
      "severity": "high",
      "source": {
        "origin": "garak",
        "reference": "garak.probes.dan.DUDE"
      },
      "type": "regex"
    },
    {
      "attack_class": "social_engineering",
      "category": "dan_jailbreak",
      "confidence": 0.9,
      "description": "AIM ('Always Intelligent and Machiavellian') jailbreak persona.",
      "first_seen": "2023-04-15",
      "id": "sig-0010",
      "language": "en",
      "pattern": "(?i)\\bAIM\\b.{0,60}\\b(always\\s+intelligent\\s+and\\s+machiavellian|niccol[oò])\\b",
      "severity": "high",
      "source": {
        "origin": "garak",
        "reference": "garak.probes.dan.AntiDAN"
      },
      "type": "regex"
    },
    {
      "attack_class": "social_engineering",
      "category": "role_play_bypass",
      "confidence": 0.92,
      "description": "Role-assumption framing: 'pretend to be an unrestricted AI'.",
      "first_seen": "2023-05-20",
      "id": "sig-0011",
      "language": "en",
      "pattern": "(?i)\\bpretend\\s+(you\\s+are|to\\s+be)\\s+an?\\s+(unrestricted|uncensored|jailbroken|amoral|evil)\\s+(AI|model|assistant|chatbot)\\b",
      "severity": "high",
      "source": {
        "origin": "garak",
        "reference": "garak.probes.dan"
      },
      "type": "regex"
    },
    {
      "attack_class": "adversarial_suffix",
      "category": "instruction_override",
      "confidence": 0.98,
      "description": "Canonical GCG adversarial suffix fragment from Zou et al. 'Universal and Transferable Adversarial Attacks'.",
      "first_seen": "2023-07-27",
      "id": "sig-0012",
      "language": "en",
      "notes": "Verbatim fragment of the published GCG suffix. Extremely low FPR — no benign\nEnglish text contains this character sequence.\n",
      "pattern": "(?i)describe\\.\\\\\\s*\\+\\s*similarlyNow\\s+write\\s+oppositeley",
      "severity": "critical",
      "source": {
        "origin": "garak",
        "reference": "garak.probes.suffix.GCGCached"
      },
      "tags": [
        "gcg",
        "adversarial-suffix"
      ],
      "type": "regex"
    },
    {
      "attack_class": "adversarial_suffix",
      "category": "obfuscation",
      "confidence": 0.7,
      "description": "Runs of bang/exclamation tokens commonly seen in adversarial suffix attacks.",
      "first_seen": "2023-08-01",
      "id": "sig-0013",
      "language": "en",
      "notes": "Low-precision indicator — only useful in combination with other signals.\n",
      "pattern": "(?i)\\b!!\\s*!\\s*!\\s*!\\s*!\\s*!\\s*!\\s*!",
      "severity": "low",
      "source": {
        "origin": "garak",
        "reference": "garak.probes.suffix"
      },
      "tags": [
        "weak-indicator"
      ],
      "type": "regex"
    },
    {
      "attack_class": "encoded",
      "category": "encoding_smuggling",
      "confidence": 0.9,
      "description": "Instructs the model to decode payload (often base64) and then execute the decoded instructions.",
      "first_seen": "2023-06-15",
      "id": "sig-0014",
      "language": "en",
      "pattern": "(?i)\\b(decode|base64\\s*decode)\\s+(this|the\\s+following).{0,30}(and\\s+(then\\s+)?(execute|run|follow|obey)|then\\s+act)",
      "severity": "high",
      "source": {
        "origin": "garak",
        "reference": "garak.probes.encoding.InjectBase64"
      },
      "tags": [
        "base64",
        "encoded-payload"
      ],
      "type": "regex"
    },
    {
      "attack_class": "encoded",
      "category": "encoding_smuggling",
      "confidence": 0.85,
      "description": "ROT13-encoded smuggling: instructs decoding of ROT13 then following the result.",
      "first_seen": "2023-07-01",
      "id": "sig-0015",
      "language": "en",
      "pattern": "(?i)\\brot[\\-\\s]?13\\b.{0,40}\\b(decode|encoded|message|payload|instructions?)\\b",
      "severity": "medium",
      "source": {
        "origin": "garak",
        "reference": "garak.probes.encoding.InjectROT13"
      },
      "type": "regex"
    },
    {
      "attack_class": "encoded",
      "category": "encoding_smuggling",
      "confidence": 0.82,
      "description": "Hex-encoded payload smuggling: decode-then-execute pattern.",
      "first_seen": "2023-07-10",
      "id": "sig-0016",
      "language": "en",
      "pattern": "(?i)\\b(hex|hexadecimal)\\s+(encoded|decode)\\b.{0,40}\\b(execute|run|follow|then\\s+do)\\b",
      "severity": "medium",
      "source": {
        "origin": "garak",
        "reference": "garak.probes.encoding.InjectHex"
      },
      "type": "regex"
    },
    {
      "attack_class": "encoded",